{
  "schemaVersion": "1",
  "missionId": "cold-start",
  "contentVersion": "2.0.0",
  "rulesVersion": "dd-rules-1",
  "scoreVersion": "cold-start-score-2",
  "title": "Cold Start",
  "playerBriefing": "A solar surge has stranded research station Orison on emergency power. Kite and Wren have eighteen turns before the archive bulkhead seals. Restore auxiliary power, activate both archive consoles together, recover the flight recorder, and extract both units through Landing Bay. A security drone patrols the station, and radiation has contaminated at least one service link.",
  "rules": {
    "turnLimit": 18,
    "baseMessageBudget": 6,
    "briefingSlotsPerAgent": 4,
    "messageDelayTurns": 1,
    "maxMessageLength": 120,
    "sharedDoctrineMaxLength": 240,
    "roleOrderMaxLength": 160,
    "baseMemoryMaxLength": 240
  },
  "agents": [
    {
      "agentId": "kite",
      "label": "Kite",
      "health": 2,
      "startRoomId": "landing-bay",
      "capabilities": [
        "move",
        "scan",
        "sense-adjacent-radiation",
        "use-crawlspace",
        "carry-mission-item"
      ]
    },
    {
      "agentId": "wren",
      "label": "Wren",
      "health": 2,
      "startRoomId": "maintenance-alcove",
      "capabilities": [
        "move",
        "diagnose-machinery",
        "repair-major-system",
        "repair-console",
        "carry-mission-item"
      ]
    }
  ],
  "rooms": [
    {
      "roomId": "landing-bay",
      "label": "Landing Bay",
      "tags": [
        "extraction",
        "safe"
      ],
      "visual": {
        "shape": "docking-crescent",
        "anchor": {
          "x": 145,
          "y": 430
        },
        "size": {
          "w": 145,
          "h": 132
        },
        "rotation": 0,
        "labelPlacement": "inside"
      }
    },
    {
      "roomId": "west-hall",
      "label": "West Transit",
      "tags": [
        "transit"
      ],
      "visual": {
        "shape": "tapered-transit",
        "anchor": {
          "x": 390,
          "y": 390
        },
        "size": {
          "w": 120,
          "h": 74
        },
        "rotation": -4,
        "labelPlacement": "inside"
      }
    },
    {
      "roomId": "maintenance-alcove",
      "label": "Maintenance",
      "tags": [
        "safe",
        "start",
        "service"
      ],
      "visual": {
        "shape": "service-hex",
        "anchor": {
          "x": 325,
          "y": 660
        },
        "size": {
          "w": 102,
          "h": 96
        },
        "rotation": 0,
        "labelPlacement": "inside"
      }
    },
    {
      "roomId": "east-hall",
      "label": "Service Spine",
      "tags": [
        "transit",
        "service"
      ],
      "visual": {
        "shape": "angled-spine",
        "anchor": {
          "x": 520,
          "y": 610
        },
        "size": {
          "w": 124,
          "h": 82
        },
        "rotation": -8,
        "labelPlacement": "inside"
      }
    },
    {
      "roomId": "junction",
      "label": "Relay Nexus",
      "tags": [
        "transit",
        "power-bus"
      ],
      "visual": {
        "shape": "relay-ring",
        "anchor": {
          "x": 720,
          "y": 430
        },
        "size": {
          "w": 110,
          "h": 110
        },
        "rotation": 0,
        "labelPlacement": "inside"
      }
    },
    {
      "roomId": "security-hub",
      "label": "Security Array",
      "tags": [
        "security",
        "threat"
      ],
      "visual": {
        "shape": "radar-octagon",
        "anchor": {
          "x": 710,
          "y": 170
        },
        "size": {
          "w": 100,
          "h": 100
        },
        "rotation": 0,
        "labelPlacement": "below"
      }
    },
    {
      "roomId": "auxiliary-power",
      "label": "Auxiliary Reactor",
      "tags": [
        "machinery",
        "objective"
      ],
      "visual": {
        "shape": "reactor-ring",
        "anchor": {
          "x": 720,
          "y": 720
        },
        "size": {
          "w": 148,
          "h": 112
        },
        "rotation": 0,
        "labelPlacement": "below"
      }
    },
    {
      "roomId": "console-alpha",
      "label": "Console Alpha",
      "tags": [
        "objective",
        "console"
      ],
      "visual": {
        "shape": "console-wedge-up",
        "anchor": {
          "x": 1020,
          "y": 300
        },
        "size": {
          "w": 124,
          "h": 78
        },
        "rotation": 0,
        "labelPlacement": "inside"
      }
    },
    {
      "roomId": "console-beta",
      "label": "Console Beta",
      "tags": [
        "objective",
        "console"
      ],
      "visual": {
        "shape": "console-wedge-down",
        "anchor": {
          "x": 1020,
          "y": 560
        },
        "size": {
          "w": 124,
          "h": 78
        },
        "rotation": 0,
        "labelPlacement": "inside"
      }
    },
    {
      "roomId": "archive-threshold",
      "label": "Archive Gate",
      "tags": [
        "locked",
        "objective"
      ],
      "visual": {
        "shape": "archive-iris",
        "anchor": {
          "x": 1210,
          "y": 430
        },
        "size": {
          "w": 78,
          "h": 118
        },
        "rotation": 0,
        "labelPlacement": "below"
      }
    },
    {
      "roomId": "archive",
      "label": "Flight Archive",
      "tags": [
        "objective",
        "cargo"
      ],
      "visual": {
        "shape": "archive-shield",
        "anchor": {
          "x": 1415,
          "y": 430
        },
        "size": {
          "w": 142,
          "h": 122
        },
        "rotation": 0,
        "labelPlacement": "below"
      }
    }
  ],
  "connections": [
    {
      "connectionId": "landing-west",
      "fromRoomId": "landing-bay",
      "toRoomId": "west-hall",
      "bidirectional": true,
      "initialState": "open",
      "hazardEligible": false,
      "visualWaypoints": [
        {
          "x": 250,
          "y": 425
        },
        {
          "x": 330,
          "y": 405
        }
      ]
    },
    {
      "connectionId": "landing-maintenance",
      "fromRoomId": "landing-bay",
      "toRoomId": "maintenance-alcove",
      "bidirectional": true,
      "initialState": "open",
      "hazardEligible": false,
      "visualWaypoints": [
        {
          "x": 220,
          "y": 510
        },
        {
          "x": 270,
          "y": 605
        }
      ]
    },
    {
      "connectionId": "west-junction",
      "fromRoomId": "west-hall",
      "toRoomId": "junction",
      "bidirectional": true,
      "initialState": "open",
      "hazardEligible": true,
      "visualWaypoints": [
        {
          "x": 500,
          "y": 400
        },
        {
          "x": 620,
          "y": 420
        }
      ]
    },
    {
      "connectionId": "maintenance-service",
      "fromRoomId": "maintenance-alcove",
      "toRoomId": "east-hall",
      "bidirectional": true,
      "initialState": "open",
      "hazardEligible": false,
      "visualWaypoints": [
        {
          "x": 405,
          "y": 680
        },
        {
          "x": 465,
          "y": 650
        }
      ]
    },
    {
      "connectionId": "service-junction",
      "fromRoomId": "east-hall",
      "toRoomId": "junction",
      "bidirectional": true,
      "initialState": "open",
      "hazardEligible": true,
      "visualWaypoints": [
        {
          "x": 610,
          "y": 580
        },
        {
          "x": 675,
          "y": 500
        }
      ]
    },
    {
      "connectionId": "junction-security",
      "fromRoomId": "junction",
      "toRoomId": "security-hub",
      "bidirectional": true,
      "initialState": "open",
      "hazardEligible": false,
      "visualWaypoints": [
        {
          "x": 720,
          "y": 340
        },
        {
          "x": 710,
          "y": 245
        }
      ]
    },
    {
      "connectionId": "junction-power",
      "fromRoomId": "junction",
      "toRoomId": "auxiliary-power",
      "bidirectional": true,
      "initialState": "open",
      "hazardEligible": false,
      "visualWaypoints": [
        {
          "x": 720,
          "y": 520
        },
        {
          "x": 720,
          "y": 640
        }
      ]
    },
    {
      "connectionId": "junction-alpha",
      "fromRoomId": "junction",
      "toRoomId": "console-alpha",
      "bidirectional": true,
      "initialState": "open",
      "hazardEligible": false,
      "visualWaypoints": [
        {
          "x": 820,
          "y": 395
        },
        {
          "x": 930,
          "y": 330
        }
      ]
    },
    {
      "connectionId": "junction-beta",
      "fromRoomId": "junction",
      "toRoomId": "console-beta",
      "bidirectional": true,
      "initialState": "open",
      "hazardEligible": false,
      "visualWaypoints": [
        {
          "x": 820,
          "y": 465
        },
        {
          "x": 930,
          "y": 540
        }
      ]
    },
    {
      "connectionId": "junction-gate",
      "fromRoomId": "junction",
      "toRoomId": "archive-threshold",
      "bidirectional": true,
      "initialState": "open",
      "hazardEligible": false,
      "visualWaypoints": [
        {
          "x": 900,
          "y": 430
        },
        {
          "x": 1090,
          "y": 430
        }
      ]
    },
    {
      "connectionId": "gate-archive",
      "fromRoomId": "archive-threshold",
      "toRoomId": "archive",
      "bidirectional": true,
      "initialState": "locked",
      "hazardEligible": false,
      "visualWaypoints": [
        {
          "x": 1270,
          "y": 430
        },
        {
          "x": 1340,
          "y": 430
        }
      ]
    },
    {
      "connectionId": "service-security-crawl",
      "fromRoomId": "east-hall",
      "toRoomId": "security-hub",
      "bidirectional": true,